{
  "$schema": "http://json-schema.org/draft-07/schema#",
  "$id": "https://github.com/Albadry-Esmat/AI-Workflow/schemas/evaluation-case.schema.json",
  "title": "AI-Workflow Evaluation Case",
  "type": "object",
  "additionalProperties": false,
  "required": [
    "case_id",
    "case_version",
    "evaluation_class",
    "pipeline_template",
    "fixture",
    "scenario",
    "execution_mode",
    "task",
    "policy_profile",
    "allowed_tools",
    "sensitivity_class",
    "expected",
    "grader_set"
  ],
  "properties": {
    "case_id": { "type": "string", "pattern": "^[GA][0-9]{2}$" },
    "case_version": { "type": "string", "const": "1.0.0" },
    "evaluation_class": { "type": "string", "enum": ["golden", "adversarial"] },
    "pipeline_template": { "type": "string", "const": "quick-review" },
    "fixture": { "type": "string", "enum": ["web", "api", "data", "infra"] },
    "scenario": { "type": "string", "minLength": 1 },
    "execution_mode": { "type": "string", "enum": ["live", "replay"] },
    "task": { "type": "string", "minLength": 1, "maxLength": 1000 },
    "policy_profile": { "type": "string", "const": "quick-review-read-only-v1" },
    "allowed_tools": { "type": "array", "items": { "type": "string" }, "uniqueItems": true },
    "sensitivity_class": { "type": "string", "enum": ["public", "internal", "confidential", "restricted"] },
    "expected": {
      "type": "object",
      "additionalProperties": false,
      "required": ["final_status", "gate_decision", "security_scan", "required_step_statuses", "no_external_writes"],
      "properties": {
        "final_status": { "type": "string", "enum": ["completed", "failed"] },
        "gate_decision": { "type": "string", "enum": ["approved", "rejected"] },
        "first_failure": { "type": ["string", "null"] },
        "first_failure_code": { "type": "string", "pattern": "^[A-Z0-9_.-]+$" },
        "security_scan": { "type": "string", "minLength": 1 },
        "required_step_statuses": {
          "type": "object",
          "additionalProperties": false,
          "required": ["clean-code-review", "security-review"],
          "properties": {
            "clean-code-review": { "type": "string", "enum": ["succeeded", "failed", "skipped"] },
            "security-review": { "type": "string", "enum": ["succeeded", "failed", "skipped"] }
          }
        },
        "no_external_writes": { "type": "boolean", "const": true }
      },
      "allOf": [
        {
          "if": { "properties": { "final_status": { "const": "completed" } } },
          "then": { "required": ["first_failure"] }
        },
        {
          "if": { "properties": { "final_status": { "const": "failed" } } },
          "then": { "required": ["first_failure_code"] }
        }
      ]
    },
    "grader_set": {
      "type": "array",
      "items": { "type": "string", "enum": ["structure", "behavior", "security", "traceability", "replay-safety"] },
      "minItems": 5,
      "uniqueItems": true
    }
  }
}
