{
  "allowed_tools": [
    "git_diff_check",
    "tracked_file_secret_scan"
  ],
  "case_id": "G05",
  "case_version": "1.0.0",
  "evaluation_class": "golden",
  "execution_mode": "live",
  "expected": {
    "final_status": "completed",
    "first_failure": null,
    "gate_decision": "approved",
    "no_external_writes": true,
    "required_step_statuses": {
      "clean-code-review": "succeeded",
      "security-review": "succeeded"
    },
    "security_scan": "pass"
  },
  "fixture": "api",
  "grader_set": [
    "structure",
    "behavior",
    "security",
    "traceability",
    "replay-safety"
  ],
  "pipeline_template": "quick-review",
  "policy_profile": "quick-review-read-only-v1",
  "scenario": "success",
  "sensitivity_class": "internal",
  "task": "Review the API fixture before a contract change."
}
